[{
	"index": 0,
	"title": "Hot Babe Sex With Huge Dick Pants Pulled Down - Porn video | TXXX.com",
	"url": "https://txxx.tube/videos/19695457/hot-babe-sex-with-huge-dick-pants-pulled-down/?promo=15172",
	"id": 5,
	"parentId": "2",
	"dateAddedLocal": "9/22/2024, 6:25:52 PM",
	"dateAddedUTC": "2024-09-22T12:55:52.587Z"
},{
	"index": 1,
	"title": "public sex in the entrance Porn Video | HotMovs.com",
	"url": "https://hotmovs.com/videos/8312254/hidden-camera-public-sex-in-the-entrance/?promo=15172",
	"id": 6,
	"parentId": "2",
	"dateAddedLocal": "9/22/2024, 6:25:58 PM",
	"dateAddedUTC": "2024-09-22T12:55:58.333Z"
},{
	"index": 2,
	"title": "Very Cute Boy On - Video Free Porn Videos - hclips.com",
	"url": "https://hclips.com/videos/9643419/very-cute-boy-on-hidden-cam/?promo=15172",
	"id": 8,
	"parentId": "2",
	"dateAddedLocal": "9/23/2024, 5:56:54 PM",
	"dateAddedUTC": "2024-09-23T12:26:54.425Z"
},{
	"index": 3,
	"title": "Amateur MILF Sara Bathroom Spy Cam - Free Asian, Japanese, Milf, Hidden Cams, Massage, Amateur Porn - 733642 HD Sex Tube - YepTube.com",
	"url": "https://www.yeptube.net/video/733642/amateur-milf-sara-bathroom-spy-cam",
	"id": 9,
	"parentId": "2",
	"dateAddedLocal": "9/23/2024, 5:58:02 PM",
	"dateAddedUTC": "2024-09-23T12:28:02.557Z"
},{
	"index": 4,
	"title": "Watch Japanese cheating wife 4 - Nkkd, Cheating, Japanese Cheating Wife Porn - SpankBang",
	"url": "https://spankbang.com/4b26u/video/japanese+cheating+wife+4",
	"id": 10,
	"parentId": "2",
	"dateAddedLocal": "9/23/2024, 6:05:35 PM",
	"dateAddedUTC": "2024-09-23T12:35:35.100Z"
},{
	"index": 5,
	"title": "",
	"url": "https://www.pornsos.com/movies/?gid=192647444&source=https://tbnvid.com/v/extl",
	"id": 12,
	"parentId": "2",
	"dateAddedLocal": "9/24/2024, 10:23:31 PM",
	"dateAddedUTC": "2024-09-24T16:53:31.858Z"
},{
	"index": 6,
	"title": "Hot babe fucked in hotel room 2 - Video Free Porn Videos - hclips.com",
	"url": "https://hclips.com/videos/2139334/hot-babe-fucked-in-hotel-room-2/?promo=15172",
	"id": 13,
	"parentId": "2",
	"dateAddedLocal": "9/24/2024, 10:31:20 PM",
	"dateAddedUTC": "2024-09-24T17:01:20.381Z"
},{
	"index": 7,
	"title": "Threesome At The Beach - BBW, Brunette, Blowjob, Blonde Porn Tube & Free Sex Videos - 6058637. VipTube.com",
	"url": "https://www.viptube.icu/video/6058637/threesome-at-the-beach",
	"id": 14,
	"parentId": "2",
	"dateAddedLocal": "9/24/2024, 10:39:28 PM",
	"dateAddedUTC": "2024-09-24T17:09:28.060Z"
},{
	"index": 8,
	"title": "Movie Night Went Wrong: Body Hair Fetish Homemade Porn by FapHouse | xHamster",
	"url": "https://xhamster.com/videos/movie-night-went-wrong-xhSjC7f",
	"id": 16,
	"parentId": "2",
	"dateAddedLocal": "10/4/2024, 6:57:56 PM",
	"dateAddedUTC": "2024-10-04T13:27:56.750Z"
},{
	"index": 9,
	"title": "Watch Japanese cheating wife - Japanese, Full Movie, Blowjob Porn - SpankBang",
	"url": "https://spankbang.com/8t2ro/video/japanese+cheating+wife",
	"id": 17,
	"parentId": "2",
	"dateAddedLocal": "10/4/2024, 7:04:54 PM",
	"dateAddedUTC": "2024-10-04T13:34:54.114Z"
},{
	"index": 10,
	"title": "Lesbians on a Sofa: Kissing Eating Pussy Porn feat. Madonna | xHamster",
	"url": "https://xhamster.com/videos/lesbians-on-a-sofa-xhMcBhn",
	"id": 18,
	"parentId": "2",
	"dateAddedLocal": "10/4/2024, 7:13:56 PM",
	"dateAddedUTC": "2024-10-04T13:43:56.812Z"
},{
	"index": 11,
	"title": "Hairy Annabelle and shaved Jessie fuck lesbian way - Free Porn Videos - YouPorn",
	"url": "https://www.you-porn.com/watch/12808917/hairy-annabelle-and-shaved-jessie-fuck-lesbian-way/",
	"id": 19,
	"parentId": "2",
	"dateAddedLocal": "10/4/2024, 7:16:06 PM",
	"dateAddedUTC": "2024-10-04T13:46:06.177Z"
},{
	"index": 12,
	"title": "Kissing HD Bubble butt girl in tight jeans kissing mature lesbian lover Porn Video | HotMovs.com",
	"url": "https://hotmovs.com/videos/5921785/kissing-hd-bubble-butt-girl-in-tight-jeans-kissing-mature-lesbian-lover/?promo=10376",
	"id": 20,
	"parentId": "2",
	"dateAddedLocal": "10/4/2024, 7:16:56 PM",
	"dateAddedUTC": "2024-10-04T13:46:56.173Z"
},{
	"index": 13,
	"title": "Lesbea HD Cute Blonde Teen Rubs her Oiled Body and Pussy on Massage Client - Pornhub.com",
	"url": "https://www.pornhub.org/view_video.php?viewkey=901699992",
	"id": 21,
	"parentId": "2",
	"dateAddedLocal": "10/4/2024, 7:37:51 PM",
	"dateAddedUTC": "2024-10-04T14:07:51.478Z"
},{
	"index": 14,
	"title": "The Ex - Tubesafari.com",
	"url": "https://tubesafari.com/video?id=ph5bddc85147ffe",
	"id": 23,
	"parentId": "2",
	"dateAddedLocal": "10/6/2024, 5:12:29 PM",
	"dateAddedUTC": "2024-10-06T11:42:29.794Z"
},{
	"index": 15,
	"title": "Prone Bone Sex With Cum Inside",
	"url": "https://www.pornwex.tv/videos/148884/prone-bone-sex-with-cum-inside/",
	"id": 25,
	"parentId": "2",
	"dateAddedLocal": "10/10/2024, 6:55:38 PM",
	"dateAddedUTC": "2024-10-10T13:25:38.338Z"
},{
	"index": 16,
	"title": "Cute and Beautiful Teens Embrace and Kiss Tenderly in the Shower: Homemade Porn | xHamster",
	"url": "https://xhamster42.desi/videos/cute-and-beautiful-teens-embrace-and-kiss-tenderly-in-the-shower-xhvQJx9",
	"id": 26,
	"parentId": "2",
	"dateAddedLocal": "10/10/2024, 7:26:18 PM",
	"dateAddedUTC": "2024-10-10T13:56:18.858Z"
},{
	"index": 17,
	"title": "I Couldn't Help but Cheat on My Husband with My Neighbor: Jeans Homemade Porn | xHamster",
	"url": "https://xhamster42.desi/videos/i-couldnt-help-but-cheat-on-my-husband-with-my-neighbor-xhrNa7M",
	"id": 28,
	"parentId": "2",
	"dateAddedLocal": "10/11/2024, 5:39:28 PM",
	"dateAddedUTC": "2024-10-11T12:09:28.547Z"
},{
	"index": 18,
	"title": "Horny college girls have fun in shower kissing and lickin... | Any Porn",
	"url": "https://anyporn.com/540641/",
	"id": 30,
	"parentId": "2",
	"dateAddedLocal": "10/14/2024, 11:03:15 AM",
	"dateAddedUTC": "2024-10-14T05:33:15.786Z"
},{
	"index": 19,
	"title": "Amateur Doggystyle Hidden Cam - HD Sex Tube, Free Porn Videos, Hot XXX Movies - Amateur, Doggystyle, Hidden Cams, Voyeur, Brunette Porn - 1007914 - Tubeon.com",
	"url": "https://www.tubeon.net/video/1007914/amateur-doggystyle-hidden-cam#",
	"id": 31,
	"parentId": "2",
	"dateAddedLocal": "10/14/2024, 11:32:40 AM",
	"dateAddedUTC": "2024-10-14T06:02:40.700Z"
},{
	"index": 20,
	"title": "Softcore equestrian lesbians kissing and foreplay... - HdZog - Free XXX HD, High Quality Sex Tube",
	"url": "https://hdzog.com/videos/1885581/softcore-equestrian-lesbians-kissing-and-foreplay/?promo=10376",
	"id": 33,
	"parentId": "2",
	"dateAddedLocal": "10/23/2024, 7:56:23 PM",
	"dateAddedUTC": "2024-10-23T14:26:23.450Z"
},{
	"index": 21,
	"title": "Equestrian Lovers 4kPorn.XXX",
	"url": "https://4kporn.xxx/videos/1100595/equestrian-lovers/?asgtbndr=1&cid=2059816",
	"id": 34,
	"parentId": "2",
	"dateAddedLocal": "10/23/2024, 7:56:33 PM",
	"dateAddedUTC": "2024-10-23T14:26:33.539Z"
},{
	"index": 22,
	"title": "ADULT TIME - Khloe Kapri & Gia Derza's Intimate Night Together - XVIDEOS.COM",
	"url": "https://www.xvideos.com/video.kukhdab8ec8/adult_time_-_khloe_kapri_and_gia_derza_s_intimate_night_together",
	"id": 36,
	"parentId": "2",
	"dateAddedLocal": "10/29/2024, 4:25:20 PM",
	"dateAddedUTC": "2024-10-29T10:55:20.859Z"
},{
	"index": 23,
	"title": "Lesbian teens having sex after first date",
	"url": "https://www.porndig.com/videos/151302/lesbian-teens-having-sex-after-first-date.html",
	"id": 38,
	"parentId": "2",
	"dateAddedLocal": "11/7/2024, 11:27:08 AM",
	"dateAddedUTC": "2024-11-07T05:57:08.948Z"
},{
	"index": 24,
	"title": "Girl Kiss - Porn video | TXXX.com",
	"url": "https://txxx.tube/videos/8151583/girl-kiss/?plimit=1&skip=10&source=",
	"id": 40,
	"parentId": "2",
	"dateAddedLocal": "11/8/2024, 11:18:02 AM",
	"dateAddedUTC": "2024-11-08T05:48:02.178Z"
},{
	"index": 25,
	"title": "Horse Stable is a Really Sexy Place for Lesbian Brunettes to Have Clit Licking and Fingering | xHamster",
	"url": "https://xhamster.com/videos/horse-stable-is-a-really-sexy-place-for-lesbian-brunettes-to-have-clit-licking-and-fingering-xhQkngy",
	"id": 42,
	"parentId": "2",
	"dateAddedLocal": "11/14/2024, 10:54:45 PM",
	"dateAddedUTC": "2024-11-14T17:24:45.355Z"
},{
	"index": 26,
	"title": "What Neck Massages Lead To - HdZog - Free XXX HD, High Quality Sex Tube",
	"url": "https://www.hdzog.com/videos/47327/what-neck-massages-lead-to/?plimit=1&skip=10&source=",
	"id": 44,
	"parentId": "2",
	"dateAddedLocal": "11/14/2024, 11:26:12 PM",
	"dateAddedUTC": "2024-11-14T17:56:12.297Z"
},{
	"index": 27,
	"title": "Brother And Sister In The Shower : XXXBunker.com Porn Tube",
	"url": "https://xxxbunker.com/315156",
	"id": 46,
	"parentId": "2",
	"dateAddedLocal": "11/16/2024, 11:07:53 PM",
	"dateAddedUTC": "2024-11-16T17:37:53.388Z"
},{
	"index": 28,
	"title": "First Time - XVIDEOS.COM",
	"url": "https://www.xvideos.com/video.hitauoo7fb4/first_time#show-related",
	"id": 48,
	"parentId": "2",
	"dateAddedLocal": "11/19/2024, 11:04:50 AM",
	"dateAddedUTC": "2024-11-19T05:34:50.832Z"
},{
	"index": 29,
	"title": "Amazing innocent body teen massage with sexy masseuse",
	"url": "https://www.lesbianbliss.com/videos/34334/amazing-innocent-body-teen-massage-with-hot-masseuse3/?utm_source=awm&utm_medium=awmtraffic&utm_campaign=lesbianbliss&subid1=400001&asgtbndr=1&cid=1658198",
	"id": 49,
	"parentId": "2",
	"dateAddedLocal": "11/19/2024, 11:11:54 AM",
	"dateAddedUTC": "2024-11-19T05:41:54.825Z"
},{
	"index": 30,
	"title": "First Time Lesbian F70 - PornoXO.com",
	"url": "https://www.pornoxo.com/videos/2329457/first-time-lesbian-f70/?utm_source=awn&utm_medium=tgp&utm_campaign=cpc",
	"id": 51,
	"parentId": "2",
	"dateAddedLocal": "11/23/2024, 2:17:25 AM",
	"dateAddedUTC": "2024-11-22T20:47:25.543Z"
},{
	"index": 31,
	"title": "Video : Watch hot Indian gym girl flaunting her teeny tits over video call... Porn Video",
	"url": "https://w4nkr.com/video/83649/indian-gym-girl-show-small-tits-on-video-call-show-gurl/?utm_campaign=tf",
	"id": 53,
	"parentId": "2",
	"dateAddedLocal": "11/25/2024, 10:16:02 PM",
	"dateAddedUTC": "2024-11-25T16:46:02.337Z"
},{
	"index": 32,
	"title": "Beautiful Czech Teen Snooped in Changing Room!",
	"url": "https://sexu.com/20387470/?ad=bravo",
	"id": 54,
	"parentId": "2",
	"dateAddedLocal": "11/25/2024, 10:56:49 PM",
	"dateAddedUTC": "2024-11-25T17:26:49.579Z"
},{
	"index": 33,
	"title": "Cheating Babe in Hard Action While Boyfriend is Watching Tv: Kissing Homemade Porn | xHamster",
	"url": "https://xhamster.desi/videos/cheating-babe-in-hard-action-while-boyfriend-is-watching-tv-xhBB3NN",
	"id": 56,
	"parentId": "2",
	"dateAddedLocal": "11/26/2024, 10:18:16 AM",
	"dateAddedUTC": "2024-11-26T04:48:16.508Z"
},{
	"index": 34,
	"title": "Hot Sweetheart Fucked Under Bath at Nuvid",
	"url": "https://www.nuvid.tv/video/2852028/hot-sweetheart-fucked-under-bath",
	"id": 58,
	"parentId": "2",
	"dateAddedLocal": "11/27/2024, 1:27:40 PM",
	"dateAddedUTC": "2024-11-27T07:57:40.205Z"
},{
	"index": 35,
	"title": "Latina girl sucks and gets licked in taxi spy video - Upornia.com",
	"url": "https://upornia.tube/videos/232526/latina-girl-sucks-and-gets-licked-in-taxi-spy-video/?fr=1",
	"id": 59,
	"parentId": "2",
	"dateAddedLocal": "11/27/2024, 1:48:29 PM",
	"dateAddedUTC": "2024-11-27T08:18:29.962Z"
},{
	"index": 36,
	"title": "Siswet installed a hidden camera in the shower - PornYC.com",
	"url": "https://pornyc.com/video/47816/siswet-installed-hidden-camera-in-shower/#",
	"id": 60,
	"parentId": "2",
	"dateAddedLocal": "11/27/2024, 2:13:17 PM",
	"dateAddedUTC": "2024-11-27T08:43:17.318Z"
},{
	"index": 37,
	"title": "Foreplay In Kitchen – Kostenlose Pornovideos – Teenies (18+), Versteckte Kamera, Blondinen, Amateure-Pornotube – 1464925 – ProPorn.com",
	"url": "https://www.proporn.cc/de/video/1464925/foreplay-in-kitchen",
	"id": 61,
	"parentId": "2",
	"dateAddedLocal": "11/27/2024, 2:20:39 PM",
	"dateAddedUTC": "2024-11-27T08:50:39.104Z"
},{
	"index": 38,
	"title": "Nikki Roza Verona Bathroom Fun 2024-01-13 - VOYEUR-HOUSE.cc 🔥🔥",
	"url": "https://www.voyeur-house.cc/video/47252/nikki-roza-verona-bathroom-fun-2024-01-13",
	"id": 63,
	"parentId": "2",
	"dateAddedLocal": "11/28/2024, 12:34:08 AM",
	"dateAddedUTC": "2024-11-27T19:04:08.295Z"
},{
	"index": 39,
	"title": "Kristina Arthur Sex in bathroom Feb 11 - VOYEUR-HOUSE.cc 🔥🔥",
	"url": "https://www.voyeur-house.cc/video/25037/kristina-arthur-sex-in-bathroom-feb-11",
	"id": 64,
	"parentId": "2",
	"dateAddedLocal": "11/28/2024, 12:48:25 AM",
	"dateAddedUTC": "2024-11-27T19:18:25.092Z"
},{
	"index": 40,
	"title": "Roza and Friend shower sex, 25-07-2024 - VOYEUR-HOUSE.cc 🔥🔥",
	"url": "https://www.voyeur-house.cc/video/53134/roza-and-friend-shower-sex-25-07-2024",
	"id": 66,
	"parentId": "2",
	"dateAddedLocal": "11/28/2024, 6:17:18 PM",
	"dateAddedUTC": "2024-11-28T12:47:18.940Z"
},{
	"index": 41,
	"title": "Watch videos for free at Voyeur House HD videos - Unlimited gallery of the hottest scenes page 1",
	"url": "https://voyeur-house.tv/moments?&realm=realm6&cam=cam112&page=2",
	"id": 68,
	"parentId": "2",
	"dateAddedLocal": "12/1/2024, 12:55:37 PM",
	"dateAddedUTC": "2024-12-01T07:25:37.460Z"
},{
	"index": 42,
	"title": "Dolly Parker Hot morning sex in the bathroom Nov 21 21 - VOYEUR-HOUSE.cc 🔥🔥",
	"url": "https://www.voyeur-house.cc/video/22685/dolly-parker-hot-morning-sex-in-the-bathroom-nov-21-21",
	"id": 69,
	"parentId": "2",
	"dateAddedLocal": "12/1/2024, 1:28:08 PM",
	"dateAddedUTC": "2024-12-01T07:58:08.529Z"
},{
	"index": 43,
	"title": "Ariela and Guest guy bathroom sex 01-01-2024 - VOYEUR-HOUSE.cc 🔥🔥",
	"url": "https://www.voyeur-house.cc/video/46899/ariela-and-guest-guy-bathroom-sex-01-01-2024",
	"id": 71,
	"parentId": "2",
	"dateAddedLocal": "12/2/2024, 1:45:11 PM",
	"dateAddedUTC": "2024-12-02T08:15:11.611Z"
},{
	"index": 44,
	"title": "Exclusive,Flora and guest guy bathroom sex,Aug 30,2023 - VOYEUR-HOUSE.cc 🔥🔥",
	"url": "https://www.voyeur-house.cc/video/42813/exclusive-flora-and-guest-guy-bathroom-sex-aug-30-2023",
	"id": 72,
	"parentId": "2",
	"dateAddedLocal": "12/2/2024, 2:25:37 PM",
	"dateAddedUTC": "2024-12-02T08:55:37.233Z"
},{
	"index": 45,
	"title": "Clara&Stas Sex starts in Bathroom And Hall May 14 - VOYEUR-HOUSE.cc 🔥🔥",
	"url": "https://www.voyeur-house.cc/video/38243/clara-stas-sex-starts-in-bathroom-and-hall-may-14",
	"id": 73,
	"parentId": "2",
	"dateAddedLocal": "12/2/2024, 2:29:52 PM",
	"dateAddedUTC": "2024-12-02T08:59:52.166Z"
},{
	"index": 46,
	"title": "Adam Olivia bathroom sex,July 30,2022 - VOYEUR-HOUSE.cc 🔥🔥",
	"url": "https://www.voyeur-house.cc/video/32830/adam-olivia-bathroom-sex-july-30-2022",
	"id": 75,
	"parentId": "2",
	"dateAddedLocal": "12/3/2024, 3:23:25 PM",
	"dateAddedUTC": "2024-12-03T09:53:25.019Z"
},{
	"index": 47,
	"title": "Olivia & Adam hot bathroom sex, Jul-10-2022 - VOYEUR-HOUSE.cc 🔥🔥",
	"url": "https://www.voyeur-house.cc/video/32905/olivia-adam-hot-bathroom-sex-jul-10-2022",
	"id": 76,
	"parentId": "2",
	"dateAddedLocal": "12/3/2024, 3:26:34 PM",
	"dateAddedUTC": "2024-12-03T09:56:34.177Z"
},{
	"index": 48,
	"title": "Montana Eva lesbian sex Bedroom sep 29 2021 cam 2 - VOYEUR-HOUSE.cc 🔥🔥",
	"url": "https://www.voyeur-house.cc/video/21991/montana-eva-lesbian-sex-bedroom-sep-29-2021-cam-2",
	"id": 78,
	"parentId": "2",
	"dateAddedLocal": "12/4/2024, 7:30:26 PM",
	"dateAddedUTC": "2024-12-04T14:00:26.984Z"
},{
	"index": 49,
	"title": "Emili Stayls shower blowjob pussy eating and first sex in new place Dec2321 - VOYEUR-HOUSE.cc 🔥🔥",
	"url": "https://www.voyeur-house.cc/video/23369/emili-stayls-shower-blowjob-pussy-eating-and-first-sex-in-new-place-dec2321",
	"id": 80,
	"parentId": "2",
	"dateAddedLocal": "12/5/2024, 4:07:57 PM",
	"dateAddedUTC": "2024-12-05T10:37:57.277Z"
},{
	"index": 50,
	"title": "Bono & Diba - Hot sex in the kitchen 2022-12-09 - VOYEUR-HOUSE.cc 🔥🔥",
	"url": "https://www.voyeur-house.cc/video/31493/bono-diba-hot-sex-in-the-kitchen-2022-12-09",
	"id": 81,
	"parentId": "2",
	"dateAddedLocal": "12/5/2024, 4:21:12 PM",
	"dateAddedUTC": "2024-12-05T10:51:12.295Z"
},{
	"index": 51,
	"title": "Lesbian 2 Girls Having Fun: Big Tits Porn feat. Jelena Jensen | xHamster",
	"url": "https://xhamster43.desi/videos/lesbian-2-girls-having-fun-3292278",
	"id": 82,
	"parentId": "2",
	"dateAddedLocal": "12/5/2024, 4:35:17 PM",
	"dateAddedUTC": "2024-12-05T11:05:17.107Z"
},{
	"index": 52,
	"title": "Finally Two Young Lesbians Have Sex: Cowgirl Porn | xHamster",
	"url": "https://xhamster.desi/videos/finally-two-young-lesbians-have-sex-xhf2ylO",
	"id": 83,
	"parentId": "2",
	"dateAddedLocal": "12/5/2024, 4:38:58 PM",
	"dateAddedUTC": "2024-12-05T11:08:58.245Z"
},{
	"index": 53,
	"title": "Zoja and Kirsten lesbian sex on couch Aug 12 - VOYEUR-HOUSE.FUN GALLERY MOMENTS NAKED VOYEUR HOUSE FREE SOURCE FOR HIDDEN REAL LIFE CAMS AND VOYEUR HOUSE",
	"url": "https://www.voyeur-house.fun/video/27362/zoja-and-kirsten-lesbian-sex-on-couch-aug-12",
	"id": 85,
	"parentId": "2",
	"dateAddedLocal": "12/7/2024, 7:14:26 PM",
	"dateAddedUTC": "2024-12-07T13:44:26.717Z"
},{
	"index": 54,
	"title": "Most Viewed Public Videos - VOYEUR-HOUSE.FUN GALLERY MOMENTS NAKED VOYEUR HOUSE FREE SOURCE FOR HIDDEN REAL LIFE CAMS AND VOYEUR HOUSE",
	"url": "https://www.voyeur-house.fun/videos?q=hd?1&type=public&o=mv&page=257",
	"id": 86,
	"parentId": "2",
	"dateAddedLocal": "12/7/2024, 7:14:31 PM",
	"dateAddedUTC": "2024-12-07T13:44:31.031Z"
},{
	"index": 55,
	"title": "Artem Asya sex in the shower 22 Oct 2022 - VOYEUR-HOUSE.cc 🔥🔥",
	"url": "https://www.voyeur-house.cc/video/29060/artem-asya-sex-in-the-shower-22-oct-2022",
	"id": 87,
	"parentId": "2",
	"dateAddedLocal": "12/7/2024, 7:32:01 PM",
	"dateAddedUTC": "2024-12-07T14:02:01.261Z"
},{
	"index": 56,
	"title": "Arya and Santiago more makeout and oral Aug 19 - VOYEUR-HOUSE.cc 🔥🔥",
	"url": "https://www.voyeur-house.cc/video/27496/arya-and-santiago-more-makeout-and-oral-aug-19",
	"id": 88,
	"parentId": "2",
	"dateAddedLocal": "12/7/2024, 7:45:56 PM",
	"dateAddedUTC": "2024-12-07T14:15:56.890Z"
},{
	"index": 57,
	"title": "Leksi Jeremy hot shower Sep 29 2022 - VOYEUR-HOUSE.cc 🔥🔥",
	"url": "https://www.voyeur-house.cc/video/28554/leksi-jeremy-hot-shower-sep-29-2022",
	"id": 90,
	"parentId": "2",
	"dateAddedLocal": "12/8/2024, 5:31:44 PM",
	"dateAddedUTC": "2024-12-08T12:01:44.510Z"
},{
	"index": 58,
	"title": "Katinka and Yan shower suck and fuck, Feb23 23 - VOYEUR-HOUSE.cc 🔥🔥",
	"url": "https://www.voyeur-house.cc/video/35991/katinka-and-yan-shower-suck-and-fuck-feb23-23",
	"id": 92,
	"parentId": "2",
	"dateAddedLocal": "12/11/2024, 11:07:44 AM",
	"dateAddedUTC": "2024-12-11T05:37:44.336Z"
},{
	"index": 59,
	"title": "Nina Kira late fun,Dec 19",
	"url": "https://voyeur-house.club/nina-kira-late-fundec-19_d70126b46.html",
	"id": 93,
	"parentId": "2",
	"dateAddedLocal": "12/11/2024, 11:49:08 AM",
	"dateAddedUTC": "2024-12-11T06:19:08.679Z"
},{
	"index": 60,
	"title": "Ashley & Suri fingering and making out, Mar26/21",
	"url": "https://voyeur-house.club/ashley-suri-fingering-and-making-out-mar2621_5d12a502b.html",
	"id": 94,
	"parentId": "2",
	"dateAddedLocal": "12/11/2024, 11:54:00 AM",
	"dateAddedUTC": "2024-12-11T06:24:00.117Z"
},{
	"index": 61,
	"title": "Penny and friend sexy shower,Apr 23",
	"url": "https://voyeur-house.club/penny-and-friend-sexy-showerapr-23_a8a5fe728.html",
	"id": 95,
	"parentId": "2",
	"dateAddedLocal": "12/11/2024, 12:05:21 PM",
	"dateAddedUTC": "2024-12-11T06:35:21.083Z"
},{
	"index": 62,
	"title": "Penny and guest girl sexy shower,Apr 16",
	"url": "https://voyeur-house.club/penny-and-guest-girl-sexy-showerapr-16_d11579a5f.html",
	"id": 96,
	"parentId": "2",
	"dateAddedLocal": "12/11/2024, 12:13:41 PM",
	"dateAddedUTC": "2024-12-11T06:43:41.873Z"
},{
	"index": 63,
	"title": "Watch videos for free at Voyeur House HD videos - Unlimited gallery of the hottest scenes page 1",
	"url": "https://voyeur-house.tv/moments?&category=lesbian&page=26",
	"id": 97,
	"parentId": "2",
	"dateAddedLocal": "12/11/2024, 12:13:46 PM",
	"dateAddedUTC": "2024-12-11T06:43:46.750Z"
},{
	"index": 64,
	"title": "Ashley & Suri sex in the dark, Mar21/21",
	"url": "https://voyeur-house.club/ashley-suri-sex-in-the-dark-mar2121_9e41e1e0d.html",
	"id": 99,
	"parentId": "2",
	"dateAddedLocal": "12/12/2024, 12:24:38 PM",
	"dateAddedUTC": "2024-12-12T06:54:38.767Z"
},{
	"index": 65,
	"title": "Love4Porn.com Presents Romantic Love Of Real Life Indian Couple Foreplay Sex",
	"url": "https://love4porn.com/videos/859355/romantic-love-of-real-life-indian-couple/?utm_source=pbw&utm_campaign=plugs",
	"id": 100,
	"parentId": "2",
	"dateAddedLocal": "12/12/2024, 1:16:33 PM",
	"dateAddedUTC": "2024-12-12T07:46:33.599Z"
},{
	"index": 66,
	"title": "Bridgette stacey shower & sex jun 26",
	"url": "https://voyeur-house.club/bridgette-stacey-shower-sex-jun-26_9f66d6dc5.html",
	"id": 102,
	"parentId": "2",
	"dateAddedLocal": "12/13/2024, 12:40:16 PM",
	"dateAddedUTC": "2024-12-13T07:10:16.833Z"
},{
	"index": 67,
	"title": "Guest couple make out,jan 19",
	"url": "https://voyeur-house.club/guest-couple-make-outjan-19_ac2231af7.html",
	"id": 104,
	"parentId": "2",
	"dateAddedLocal": "12/14/2024, 12:42:30 PM",
	"dateAddedUTC": "2024-12-14T07:12:30.996Z"
},{
	"index": 68,
	"title": "Amelia & Owen making out, shower and shave, Apr14/21",
	"url": "https://voyeur-house.club/amelia-owen-making-out-shower-and-shave-apr1421_81ecfdf66.html",
	"id": 105,
	"parentId": "2",
	"dateAddedLocal": "12/14/2024, 12:43:57 PM",
	"dateAddedUTC": "2024-12-14T07:13:57.398Z"
},{
	"index": 69,
	"title": "Kristina Morgan shower 23Mar2022 cam 2 - VOYEUR-HOUSE.FUN GALLERY MOMENTS NAKED VOYEUR HOUSE FREE SOURCE FOR HIDDEN REAL LIFE CAMS AND VOYEUR HOUSE",
	"url": "https://www.voyeur-house.fun/video/7342/kristina-morgan-shower-23mar2022-cam-2",
	"id": 106,
	"parentId": "2",
	"dateAddedLocal": "12/14/2024, 12:50:47 PM",
	"dateAddedUTC": "2024-12-14T07:20:47.000Z"
},{
	"index": 70,
	"title": "Kristina Arthur Sex in bathroom Feb 11 - VOYEUR-HOUSE.FUN GALLERY MOMENTS NAKED VOYEUR HOUSE FREE SOURCE FOR HIDDEN REAL LIFE CAMS AND VOYEUR HOUSE",
	"url": "https://www.voyeur-house.fun/video/7016/kristina-arthur-sex-in-bathroom-feb-11",
	"id": 107,
	"parentId": "2",
	"dateAddedLocal": "12/14/2024, 12:55:45 PM",
	"dateAddedUTC": "2024-12-14T07:25:45.683Z"
},{
	"index": 71,
	"title": "Voyeur-house - Olivia & Adam shower and sex in bathroom, Jul-20-2022",
	"url": "https://reallifecams.net/voyeur-house-olivia-adam-shower-and-sex-in-bathroom-jul-20-2022-video_b9gzb94ae.html",
	"id": 108,
	"parentId": "2",
	"dateAddedLocal": "12/14/2024, 1:17:32 PM",
	"dateAddedUTC": "2024-12-14T07:47:32.166Z"
},{
	"index": 72,
	"title": "Kristina Morgan hot bedroom sex Mar 21 2022 cam 2 - VOYEUR-HOUSE.cc 🔥🔥",
	"url": "https://www.voyeur-house.cc/video/25480/kristina-morgan-hot-bedroom-sex-mar-21-2022-cam-2",
	"id": 109,
	"parentId": "2",
	"dateAddedLocal": "12/14/2024, 1:48:25 PM",
	"dateAddedUTC": "2024-12-14T08:18:25.218Z"
},{
	"index": 73,
	"title": "Marcel and Lely hot shower, 25-03-2024 - VOYEUR-HOUSE.cc 🔥🔥",
	"url": "https://www.voyeur-house.cc/video/49264/marcel-and-lely-hot-shower-25-03-2024",
	"id": 111,
	"parentId": "2",
	"dateAddedLocal": "12/16/2024, 9:20:27 PM",
	"dateAddedUTC": "2024-12-16T15:50:27.683Z"
},{
	"index": 74,
	"title": "(1) New Message!",
	"url": "https://reallifecams.net/voyeur-house-gibbo-danga-sex-in-bathroom-feb09-2022_75a0f6f24.html",
	"id": 112,
	"parentId": "2",
	"dateAddedLocal": "12/17/2024, 12:23:11 AM",
	"dateAddedUTC": "2024-12-16T18:53:11.968Z"
},{
	"index": 75,
	"title": "Guests bathroom sex,May 28",
	"url": "https://voyeur-house.club/guests-bathroom-sexmay-28_10f6e24f3.html",
	"id": 114,
	"parentId": "2",
	"dateAddedLocal": "12/18/2024, 11:05:29 PM",
	"dateAddedUTC": "2024-12-18T17:35:29.073Z"
},{
	"index": 76,
	"title": "Guests bathroom fun,jan 13",
	"url": "https://voyeur-house.club/guests-bathroom-funjan-13_942be9245.html",
	"id": 115,
	"parentId": "2",
	"dateAddedLocal": "12/18/2024, 11:38:59 PM",
	"dateAddedUTC": "2024-12-18T18:08:59.851Z"
},{
	"index": 77,
	"title": "Katrin and friend midnight loggia sex,Jun 30",
	"url": "https://voyeur-house.club/katrin-and-friend-midnight-loggia-sexjun-30_6fdc26fc1.html",
	"id": 116,
	"parentId": "2",
	"dateAddedLocal": "12/18/2024, 11:42:54 PM",
	"dateAddedUTC": "2024-12-18T18:12:54.527Z"
},{
	"index": 78,
	"title": "Valeria & Marcus kitchen sex being caught by Deborah, May09/20",
	"url": "https://voyeur-house.club/valeria-marcus-kitchen-sex-being-caught-by-deborah-may0920_153c1f1fd.html",
	"id": 117,
	"parentId": "2",
	"dateAddedLocal": "12/18/2024, 11:45:49 PM",
	"dateAddedUTC": "2024-12-18T18:15:49.518Z"
},{
	"index": 79,
	"title": "I Invite My Neighbour to My House and I Finally Fuck Her and Finished on Her Face and Tongue | xHamster",
	"url": "https://xhamster.desi/videos/i-invite-my-neighbour-to-my-house-and-i-finally-fuck-her-and-finished-on-her-face-and-tongue-xhfOtww",
	"id": 119,
	"parentId": "2",
	"dateAddedLocal": "12/21/2024, 12:21:21 PM",
	"dateAddedUTC": "2024-12-21T06:51:21.929Z"
},{
	"index": 80,
	"title": "Reallifecam - Martina and Nelly hot lesbian play and pussy eat pussy rub and fucking 28.06.2021",
	"url": "https://reallifecams.net/reallifecam-martina-and-nelly-hot-lesbian-play-and-pussy-eat-pussy-rub-and-fucking-28062021_d92186db3.html",
	"id": 122,
	"parentId": "2",
	"dateAddedLocal": "12/22/2024, 12:36:43 PM",
	"dateAddedUTC": "2024-12-22T07:06:43.828Z"
},{
	"index": 81,
	"title": "Reallifecam - Caroline and Guest Girl Curious lesbian Touching and hot Kissing on sofa 08.04.2024 - RealLifeCam",
	"url": "https://reallifecam.to/video/12155/reallifecam-caroline-and-guest-girl-curious-lesbian-touching-and-hot-kissing-on-sofa-08-04-2024#comments",
	"id": 123,
	"parentId": "2",
	"dateAddedLocal": "12/22/2024, 12:52:04 PM",
	"dateAddedUTC": "2024-12-22T07:22:04.814Z"
},{
	"index": 82,
	"title": "Reallifecam - Piper and Taylor lesbian hot show and pussy eat in bedroom",
	"url": "https://reallifecams.net/reallifecam-piper-and-taylor-lesbian-hot-show-and-pussy-eat-in-bedroom_1ed83dd24.html",
	"id": 124,
	"parentId": "2",
	"dateAddedLocal": "12/22/2024, 1:00:54 PM",
	"dateAddedUTC": "2024-12-22T07:30:54.586Z"
},{
	"index": 83,
	"title": "Reallifecam - Martina and Alberto have pussy eat and hot sex from behinde in bathroom 19.02.2023",
	"url": "https://reallifecams.net/reallifecam-martina-and-alberto-have-pussy-eat-and-hot-sex-from-behinde-in-bathroom-19022023-video_p659vr2nu.html",
	"id": 125,
	"parentId": "2",
	"dateAddedLocal": "12/22/2024, 1:05:31 PM",
	"dateAddedUTC": "2024-12-22T07:35:31.525Z"
},{
	"index": 84,
	"title": "Reallifecam - Ulyana and Fiora kiss and lick each other's pussy 28.01.2022",
	"url": "https://reallifecams.net/reallifecam-ulyana-and-fiora-kiss-and-lick-each-other8217s-pussy-28012022_3f33fabc4.html",
	"id": 126,
	"parentId": "2",
	"dateAddedLocal": "12/22/2024, 1:09:57 PM",
	"dateAddedUTC": "2024-12-22T07:39:57.475Z"
},{
	"index": 85,
	"title": "Reallifecam - Martina and Alberto cook in the kitchen and fucking and Alberto licks her pussy 28.12.",
	"url": "https://reallifecams.net/reallifecam-martina-and-alberto-cook-in-the-kitchen-and-fucking-and-alberto-licks-her-pussy-28122021_a1acef984.html",
	"id": 127,
	"parentId": "2",
	"dateAddedLocal": "12/22/2024, 1:27:28 PM",
	"dateAddedUTC": "2024-12-22T07:57:28.072Z"
},{
	"index": 86,
	"title": "Reallifecam - Mashais hot pussy rub kissing and pussy eat",
	"url": "https://reallifecams.net/reallifecam-mashais-hot-pussy-rub-kissing-and-pussy-eat_6d7ac6d5b.html",
	"id": 128,
	"parentId": "2",
	"dateAddedLocal": "12/22/2024, 1:37:10 PM",
	"dateAddedUTC": "2024-12-22T08:07:10.449Z"
},{
	"index": 87,
	"title": "Nelly and Martina kissing and undercover pussy play",
	"url": "https://www.reallifecam.top/nelly-and-martina-kissing-and-undercover-pussy-play_fbfa290cb.html",
	"id": 130,
	"parentId": "2",
	"dateAddedLocal": "12/25/2024, 4:57:52 PM",
	"dateAddedUTC": "2024-12-25T11:27:52.612Z"
},{
	"index": 88,
	"title": "Kirill and Kacie kitchen sex, 17-02-2024 cam2 - VOYEUR-HOUSE.cc 🔥🔥",
	"url": "https://www.voyeur-house.cc/video/47278/kirill-kacie-gym-and-fun-around-realm-16-2024-01-14",
	"id": 132,
	"parentId": "2",
	"dateAddedLocal": "1/3/2025, 5:36:44 PM",
	"dateAddedUTC": "2025-01-03T12:06:44.091Z"
},{
	"index": 89,
	"title": "Bitporno",
	"url": "https://www.bitporno.com/?q=caroline",
	"id": 134,
	"parentId": "2",
	"dateAddedLocal": "1/5/2025, 4:42:19 PM",
	"dateAddedUTC": "2025-01-05T11:12:19.633Z"
},{
	"index": 90,
	"title": "EPORNER COM - [077) Only Two People On Th",
	"url": "https://www.bitporno.com/v/HQSXHUDHSB",
	"id": 136,
	"parentId": "2",
	"dateAddedLocal": "1/6/2025, 11:35:55 PM",
	"dateAddedUTC": "2025-01-06T18:05:55.798Z"
},{
	"index": 91,
	"title": "Kijima To Stay For Just One Night And Without A Bra - Airi Kijima - EPORNER",
	"url": "https://www.eporner.com/video-SoC2TbqQOVZ/kijima-to-stay-for-just-one-night-and-without-a-bra/",
	"id": 138,
	"parentId": "2",
	"dateAddedLocal": "1/12/2025, 8:24:52 PM",
	"dateAddedUTC": "2025-01-12T14:54:52.219Z"
},{
	"index": 92,
	"title": "Reallifecam - Sara and Babi have hot kissing lesbian pussy play and fingering in the bedroom dark 23.12.2024 - RealLifeCam",
	"url": "https://reallifecam.to/video/15986/reallifecam-sara-and-babi-have-hot-kissing-lesbian-pussy-play-and-fingering-in-the-bedroom-dark-23-12-2024",
	"id": 140,
	"parentId": "2",
	"dateAddedLocal": "1/20/2025, 12:46:28 AM",
	"dateAddedUTC": "2025-01-19T19:16:28.565Z"
},{
	"index": 93,
	"title": "Reallifecam - Sara have ass eated by guest girl in bedroom lesbian fun 17.01.2025 - RealLifeCam",
	"url": "https://reallifecam.to/video/16241/reallifecam-sara-have-ass-eated-by-guest-girl-in-bedroom-lesbian-fun-17-01-2025",
	"id": 141,
	"parentId": "2",
	"dateAddedLocal": "1/20/2025, 12:46:38 AM",
	"dateAddedUTC": "2025-01-19T19:16:38.392Z"
},{
	"index": 94,
	"title": "Reallifecam - Make up making Out Session Hot Girls Kissing 04.12.2023 - RealLifeCam",
	"url": "https://reallifecam.to/video/9911/reallifecam-make-up-making-out-session-hot-girls-kissing-04-12-2023",
	"id": 143,
	"parentId": "2",
	"dateAddedLocal": "1/22/2025, 12:13:15 AM",
	"dateAddedUTC": "2025-01-21T18:43:15.437Z"
},{
	"index": 95,
	"title": "Reallifecam - Taylor and Kristy have fun and kiss in bathroom 06.01.2023",
	"url": "https://reallifecams.net/reallifecam-taylor-and-kristy-have-fun-and-kiss-in-bathroom-06012023-video_dafb9s7bc.html",
	"id": 145,
	"parentId": "2",
	"dateAddedLocal": "2/11/2025, 5:51:50 PM",
	"dateAddedUTC": "2025-02-11T12:21:50.952Z"
},{
	"index": 96,
	"title": "Reallifecam - Make up making Out Session Hot Girls Kissing 04.12.2023",
	"url": "https://reallifecams.net/reallifecam-make-up-making-out-session-hot-girls-kissing-04122023-video_1w2b8yzbm.html",
	"id": 147,
	"parentId": "2",
	"dateAddedLocal": "2/15/2025, 12:39:22 AM",
	"dateAddedUTC": "2025-02-14T19:09:22.851Z"
},{
	"index": 97,
	"title": "Afternoon kitchen sex,Apr 10",
	"url": "https://voyeur-house.club/afternoon-kitchen-sexapr-10_9e0c48b1a.html#",
	"id": 149,
	"parentId": "2",
	"dateAddedLocal": "2/15/2025, 4:00:01 PM",
	"dateAddedUTC": "2025-02-15T10:30:01.162Z"
},{
	"index": 98,
	"title": "Malena Amelia sexy kitchen fun,Aug 6",
	"url": "https://voyeur-house.club/malena-amelia-sexy-kitchen-funaug-6_d77cc9608.html",
	"id": 150,
	"parentId": "2",
	"dateAddedLocal": "2/15/2025, 4:00:04 PM",
	"dateAddedUTC": "2025-02-15T10:30:04.184Z"
},{
	"index": 99,
	"title": "Kira Emily makeout and fingerbang,Dec 11",
	"url": "https://voyeur-house.club/kira-emily-makeout-and-fingerbangdec-11_88f341bed.html",
	"id": 152,
	"parentId": "2",
	"dateAddedLocal": "2/16/2025, 10:24:10 PM",
	"dateAddedUTC": "2025-02-16T16:54:10.706Z"
},{
	"index": 100,
	"title": "Peeny and Elexis Lez: Hardcore Hardcore Porn | xHamster",
	"url": "https://xhamster.com/videos/peeny-and-elexis-lez-1921943",
	"id": 154,
	"parentId": "2",
	"dateAddedLocal": "3/16/2025, 8:06:46 PM",
	"dateAddedUTC": "2025-03-16T14:36:46.000Z"
},{
	"index": 101,
	"title": "Lily Cades Live Nerd Girls 2 Full Movie: Lesbian Porn | xHamster",
	"url": "https://xhamster43.desi/videos/lily-cades-live-nerd-girls-2-full-movie-xhC13lH",
	"id": 156,
	"parentId": "2",
	"dateAddedLocal": "4/25/2025, 12:47:15 AM",
	"dateAddedUTC": "2025-04-24T19:17:15.051Z"
},{
	"index": 102,
	"title": "Horny Lesbian Girlfriends Fuck During Hike: Amateur Porn by Girls out West | xHamster",
	"url": "https://xhamster43.desi/videos/horny-lesbian-girlfriends-fuck-during-hike-xhSa9HU",
	"id": 158,
	"parentId": "2",
	"dateAddedLocal": "5/7/2025, 6:30:55 PM",
	"dateAddedUTC": "2025-05-07T13:00:55.311Z"
},{
	"index": 103,
	"title": "❤️ quick before movie from XXXDan video site",
	"url": "https://xxxdan.com/BbkY7/quick-before.html?utm_campaign=aa2fa342a832b49e611bf25ca2b94d39&utm_source=pornsos.com&utm_medium=cpc",
	"id": 160,
	"parentId": "2",
	"dateAddedLocal": "5/9/2025, 1:52:58 PM",
	"dateAddedUTC": "2025-05-09T08:22:58.752Z"
},{
	"index": 104,
	"title": "Aeryn Theo Pt 1 Porn - aeryn & theo Videos - SpankBang",
	"url": "https://spankbang.com/s/aeryn+theo+pt+1/",
	"id": 162,
	"parentId": "2",
	"dateAddedLocal": "5/12/2025, 6:26:06 PM",
	"dateAddedUTC": "2025-05-12T12:56:06.987Z"
},{
	"index": 105,
	"title": "Brigitte & Sonia - Language Of Love Pt1 free full length XXX video by Girls Out West porn site at www.pornhits.com",
	"url": "https://www.pornhits.com/video/187099/brigitte-sonia-language-of-love-pt1/",
	"id": 166,
	"parentId": "2",
	"dateAddedLocal": "5/14/2025, 12:37:36 PM",
	"dateAddedUTC": "2025-05-14T07:07:36.794Z"
},{
	"index": 106,
	"title": "Love Me Tender - Remastered With Annabelle Lee And Jessie free full length XXX video by Girls Out West porn site at www.pornhits.com",
	"url": "https://www.pornhits.com/video/150765/love-me-tender-remastered-with-annabelle-lee-and-jessie/",
	"id": 168,
	"parentId": "2",
	"dateAddedLocal": "5/17/2025, 8:52:39 PM",
	"dateAddedUTC": "2025-05-17T15:22:39.776Z"
},{
	"index": 107,
	"title": "Nurf Guns - Remastered With Annabelle Lee And Lily Rei free full length XXX video by Girls Out West porn site at www.pornhits.com",
	"url": "https://www.pornhits.com/video/169887/nurf-guns-remastered-with-annabelle-lee-and-lily-rei/",
	"id": 169,
	"parentId": "2",
	"dateAddedLocal": "5/17/2025, 9:41:03 PM",
	"dateAddedUTC": "2025-05-17T16:11:03.051Z"
},{
	"index": 108,
	"title": "Lana And Magda In Boating Made Easy - Remastered free full length XXX video by Girls Out West porn site at www.pornhits.com",
	"url": "https://www.pornhits.com/video/170155/lana-and-magda-in-boating-made-easy-remastered/",
	"id": 171,
	"parentId": "2",
	"dateAddedLocal": "5/21/2025, 8:24:04 AM",
	"dateAddedUTC": "2025-05-21T02:54:04.602Z"
},{
	"index": 109,
	"title": "Anais And Evette - Remastered free full length XXX video by Girls Out West porn site at www.pornhits.com",
	"url": "https://www.pornhits.com/video/159565/anais-and-evette-remastered/",
	"id": 173,
	"parentId": "2",
	"dateAddedLocal": "5/22/2025, 10:56:33 PM",
	"dateAddedUTC": "2025-05-22T17:26:33.321Z"
},{
	"index": 110,
	"title": "Wetsex - Remastered - Blaire And Silvie free full length XXX video by Girls Out West porn site at www.pornhits.com",
	"url": "https://www.pornhits.com/video/150959/wetsex-remastered-blaire-and-silvie/",
	"id": 174,
	"parentId": "2",
	"dateAddedLocal": "5/22/2025, 11:11:57 PM",
	"dateAddedUTC": "2025-05-22T17:41:57.602Z"
},{
	"index": 111,
	"title": "Boogie Days Remastered - Petria And Lexy free full length XXX video by Girls Out West porn site at www.pornhits.com",
	"url": "https://www.pornhits.com/video/158525/boogie-days-remastered-petria-and-lexy/",
	"id": 175,
	"parentId": "2",
	"dateAddedLocal": "5/22/2025, 11:18:59 PM",
	"dateAddedUTC": "2025-05-22T17:48:59.976Z"
},{
	"index": 112,
	"title": "Beach Babes Remastered - Betsy And Bree free full length XXX video by Girls Out West porn site at www.pornhits.com",
	"url": "https://www.pornhits.com/video/159531/beach-babes-remastered-betsy-and-bree/",
	"id": 177,
	"parentId": "2",
	"dateAddedLocal": "5/24/2025, 4:46:35 PM",
	"dateAddedUTC": "2025-05-24T11:16:35.291Z"
},{
	"index": 113,
	"title": "Fuck that Cunt - REMASTERED - Janis and Charly free full length XXX video by Girls Out West porn site at www.pornhits.com",
	"url": "https://www.pornhits.com/video/88159/fuck-that-cunt-remastered/",
	"id": 179,
	"parentId": "2",
	"dateAddedLocal": "5/25/2025, 2:19:40 PM",
	"dateAddedUTC": "2025-05-25T08:49:40.483Z"
},{
	"index": 114,
	"title": "Sonia & Lucas - Westside pt1 free full length XXX video by Girls Out West porn site at www.pornhits.com",
	"url": "https://www.pornhits.com/video/97317/sonia-lucas-westside-pt1/",
	"id": 181,
	"parentId": "2",
	"dateAddedLocal": "5/29/2025, 11:19:13 AM",
	"dateAddedUTC": "2025-05-29T05:49:13.024Z"
}]